{
  "name": "Good Plugin",
  "version": "1.2.3",
  "contactEmailAddress": "good@example.com",
  "requiredDependencies": ["LibraryPlugin"],
  "optionalDependencies": { "Pretty": "PrettyUI" },
  "requiredPermissions": ["httpAccess"],
  "optionalPermissions": ["chatAccess"],
  "urls": { "wiki": "https://runescape.wiki/", "api": "http://api.example.com/v1" },
  "hasSettingsIcon": true
}
