{
  "$schema": "https://raw.githubusercontent.com/TMHSDigital/RS3-Developer-Tools/main/packages/schema/plugin.schema.json",
  "name": "Chat Logger",
  "version": "0.1.0",
  "contactEmailAddress": "chat-logger@example.com",
  "requiredDependencies": [],
  "optionalDependencies": [],
  "requiredPermissions": [],
  "optionalPermissions": ["chatAccess"]
}
