{
  "$schema": "https://raw.githubusercontent.com/TMHSDigital/RS3-Developer-Tools/main/packages/schema/plugin.schema.json",
  "name": "Hello Counter",
  "version": "0.1.0",
  "contactEmailAddress": "hello-counter@example.com",
  "requiredDependencies": [],
  "optionalDependencies": [],
  "requiredPermissions": [],
  "optionalPermissions": []
}
